Course,URL,University
"Programs, Information and People",https://www.si.umich.edu/programs/courses/106,University of Michigan
Introduction to Information Studies,https://www.si.umich.edu/programs/courses/110,University of Michigan
Data-Oriented Programming,https://www.si.umich.edu/programs/courses/206,University of Michigan
Opportunity in the Age of Intelligent Machines,https://www.si.umich.edu/programs/courses/260,University of Michigan
Career and Internship Studio: Design Your Success,https://www.si.umich.edu/programs/courses/300,University of Michigan
Models of Social Information Processing,https://www.si.umich.edu/programs/courses/301,University of Michigan
Information Environments and Work,https://www.si.umich.edu/programs/courses/310,University of Michigan
Special Topics in Information,https://www.si.umich.edu/programs/courses/311,University of Michigan
Interpersonal and Psychological Implications of Social Media,https://www.si.umich.edu/programs/courses/315,University of Michigan
Designing and Analyzing Social Media Feeds,https://www.si.umich.edu/programs/courses/316,University of Michigan
Graphic Design,https://www.si.umich.edu/programs/courses/320,University of Michigan
Data Manipulation,https://www.si.umich.edu/programs/courses/330,University of Michigan
Persuasion and Social Influence,https://www.si.umich.edu/programs/courses/334,University of Michigan
Social Media in Organizations,https://www.si.umich.edu/programs/courses/335,University of Michigan
"Web Design, Development, and Accessibility",https://www.si.umich.edu/programs/courses/339,University of Michigan
Experiment Design and Analyses,https://www.si.umich.edu/programs/courses/340,University of Michigan
Succeeding at Failing: The Art of Entrepreneurship in the Information Age,https://www.si.umich.edu/programs/courses/360,University of Michigan
Building Interactive Applications,https://www.si.umich.edu/programs/courses/364,University of Michigan
Cyberscience: Computational Science and the Rise of the Fourth Paradigm,https://www.si.umich.edu/programs/courses/365,University of Michigan
Data Exploration,https://www.si.umich.edu/programs/courses/370,University of Michigan
"Putting the H in HCI: Human Perception, Cognition and Mental Processes",https://www.si.umich.edu/programs/courses/388,University of Michigan
Design and Implementation of Web Surveys,https://www.si.umich.edu/programs/courses/400,University of Michigan
Senior Final Project Preparation Course,https://www.si.umich.edu/programs/courses/405,University of Michigan
Ethics and Information Technology,https://www.si.umich.edu/programs/courses/410,University of Michigan
Needs Assessment and Usability Evaluation,https://www.si.umich.edu/programs/courses/422,University of Michigan
Introduction to User Modeling,https://www.si.umich.edu/programs/courses/425,University of Michigan
Online Communities: Analysis and Design of Online Interaction,https://www.si.umich.edu/programs/courses/429,University of Michigan
Information Technology and Global Society,https://www.si.umich.edu/programs/courses/430,University of Michigan
Self-Organization in Science and Society,https://www.si.umich.edu/programs/courses/432,University of Michigan
Exploring Computational Thinking Through Making,https://www.si.umich.edu/programs/courses/435,University of Michigan
Modeling Success: The Science of Entrepreneurship in the Information Age,https://www.si.umich.edu/programs/courses/460,University of Michigan
Interaction Design Studio,https://www.si.umich.edu/programs/courses/482,University of Michigan
Information Analytics Project,https://www.si.umich.edu/programs/courses/485,University of Michigan
User Experience Final Project,https://www.si.umich.edu/programs/courses/487,University of Michigan
Designing Engagement Through Social Media,https://www.si.umich.edu/programs/courses/489,University of Michigan
Contextual Inquiry and Consulting Foundations,https://www.si.umich.edu/programs/courses/501,University of Michigan
"Networked Computing: Storage, Communication, and Processing",https://www.si.umich.edu/programs/courses/502,University of Michigan
Career and Internship Studio: Design Your Success,https://www.si.umich.edu/programs/courses/505,University of Michigan
Programming I,https://www.si.umich.edu/programs/courses/506,University of Michigan
Intermediate Programming,https://www.si.umich.edu/programs/courses/507,University of Michigan
Intensive Python Programming for Information Students,https://www.si.umich.edu/programs/courses/508,University of Michigan
Special Topics,https://www.si.umich.edu/programs/courses/511,University of Michigan
Special Topics,https://www.si.umich.edu/programs/courses/514,University of Michigan
Engineering Applications of Media Technology,https://www.si.umich.edu/programs/courses/515,University of Michigan
Special Topics,https://www.si.umich.edu/programs/courses/517,University of Michigan
Intellectual Property and Information Law,https://www.si.umich.edu/programs/courses/519,University of Michigan
Graphic Design and Visual Communications,https://www.si.umich.edu/programs/courses/520,University of Michigan
Advanced Psychoacoustics,https://www.si.umich.edu/programs/courses/521,University of Michigan
Information and Control,https://www.si.umich.edu/programs/courses/523,University of Michigan
Managing Organizational Information Assets,https://www.si.umich.edu/programs/courses/528,University of Michigan
Online Communities,https://www.si.umich.edu/programs/courses/529,University of Michigan
Principles in Management,https://www.si.umich.edu/programs/courses/530,University of Michigan
Human Interaction in Information Retrieval,https://www.si.umich.edu/programs/courses/531,University of Michigan
Theories of Social Influence,https://www.si.umich.edu/programs/courses/534,University of Michigan
Introduction to Urban Informatics,https://www.si.umich.edu/programs/courses/536,University of Michigan
Crisis Informatics,https://www.si.umich.edu/programs/courses/537,University of Michigan
Citizen Interaction Design,https://www.si.umich.edu/programs/courses/538,University of Michigan
Design of Complex Websites,https://www.si.umich.edu/programs/courses/539,University of Michigan
Privacy in Information Technology,https://www.si.umich.edu/programs/courses/540,University of Michigan
Introduction to Statistics and Data Analysis,https://www.si.umich.edu/programs/courses/544,University of Michigan
Engaging with Communities,https://www.si.umich.edu/programs/courses/547,University of Michigan
Principles of Software Design for Learning,https://www.si.umich.edu/programs/courses/548,University of Michigan
Transformative Learning and Teaching with Technology,https://www.si.umich.edu/programs/courses/549,University of Michigan
Information Behavior and Search Experience,https://www.si.umich.edu/programs/courses/551,University of Michigan
Consumer Health Informatics,https://www.si.umich.edu/programs/courses/554,University of Michigan
Introduction to AR/VR Application Design,https://www.si.umich.edu/programs/courses/559,University of Michigan
Natural Language Processing,https://www.si.umich.edu/programs/courses/561,University of Michigan
Game Theory,https://www.si.umich.edu/programs/courses/563,University of Michigan
Language and Information,https://www.si.umich.edu/programs/courses/565,University of Michigan
Semantics-Based Knowledge Descriptions and Organization,https://www.si.umich.edu/programs/courses/570,University of Michigan
Health Informatics Program Seminar I,https://www.si.umich.edu/programs/courses/573,University of Michigan
Health Informatics Program Seminar,https://www.si.umich.edu/programs/courses/574,University of Michigan
Understanding Records and Archives: Principles and Practices,https://www.si.umich.edu/programs/courses/580,University of Michigan
Introduction to Interaction Design,https://www.si.umich.edu/programs/courses/582,University of Michigan
Fundamentals of Human Behavior,https://www.si.umich.edu/programs/courses/588,University of Michigan
Connected and Autonomous Vehicle Technology: Business and Regulatory Issues,https://www.si.umich.edu/programs/courses/604,University of Michigan
Interdisciplinary Problem Solving,https://www.si.umich.edu/programs/courses/605,University of Michigan
Personal Informatics Design,https://www.si.umich.edu/programs/courses/606,University of Michigan
Networks,https://www.si.umich.edu/programs/courses/608,University of Michigan
Population Health Informatics,https://www.si.umich.edu/programs/courses/611,University of Michigan
Pervasive Interaction Design,https://www.si.umich.edu/programs/courses/612,University of Michigan
Advanced Topics in Graphic Design and Communication,https://www.si.umich.edu/programs/courses/616,University of Michigan
Choice Architecture,https://www.si.umich.edu/programs/courses/617,University of Michigan
Data Manipulation and Analysis,https://www.si.umich.edu/programs/courses/618,University of Michigan
Collection Development and Management,https://www.si.umich.edu/programs/courses/620,University of Michigan
Needs Assessment and Usability Evaluation,https://www.si.umich.edu/programs/courses/622,University of Michigan
Research Methods for Information Professionals,https://www.si.umich.edu/programs/courses/623,University of Michigan
Digital Preservation,https://www.si.umich.edu/programs/courses/625,University of Michigan
Managing and Leading the IT Org,https://www.si.umich.edu/programs/courses/627,University of Michigan
Access Systems,https://www.si.umich.edu/programs/courses/629,University of Michigan
Natural Language Processing: Algorithms and People,https://www.si.umich.edu/programs/courses/630,University of Michigan
Agile Software Development for Content Management Systems,https://www.si.umich.edu/programs/courses/631,University of Michigan
Appraisal of Archives,https://www.si.umich.edu/programs/courses/632,University of Michigan
Content Management Systems Configuration and Site Building,https://www.si.umich.edu/programs/courses/634,University of Michigan
Content Management Systems and Web Frameworks,https://www.si.umich.edu/programs/courses/635,University of Michigan
"Makerspaces, Maker Culture, Maker Tools",https://www.si.umich.edu/programs/courses/636,University of Michigan
Web Archiving,https://www.si.umich.edu/programs/courses/639,University of Michigan
Digital Libraries and Archives,https://www.si.umich.edu/programs/courses/640,University of Michigan
Instructional Skills for Information Professionals,https://www.si.umich.edu/programs/courses/643,University of Michigan
Information Economics,https://www.si.umich.edu/programs/courses/646,University of Michigan
Information Resources and Services,https://www.si.umich.edu/programs/courses/647,University of Michigan
Evaluation Methods in Health Informatics,https://www.si.umich.edu/programs/courses/648,University of Michigan
Information Visualization,https://www.si.umich.edu/programs/courses/649,University of Michigan
Information Retrieval,https://www.si.umich.edu/programs/courses/650,University of Michigan
Electronic Commerce,https://www.si.umich.edu/programs/courses/652,University of Michigan
Evidence-Informed Decision-Making for the 21st Century Health Care,https://www.si.umich.edu/programs/courses/653,University of Michigan
Critical Policy Issues in Health IT,https://www.si.umich.edu/programs/courses/654,University of Michigan
Information Architecture,https://www.si.umich.edu/programs/courses/658,University of Michigan
Developing AR/VR Experiences,https://www.si.umich.edu/programs/courses/659,University of Michigan
Experimental Social Computing Systems,https://www.si.umich.edu/programs/courses/660,University of Michigan
Managing Health Informatics,https://www.si.umich.edu/programs/courses/661,University of Michigan
Entrepreneurship in the Information Industry,https://www.si.umich.edu/programs/courses/663,University of Michigan
Database Application Design,https://www.si.umich.edu/programs/courses/664,University of Michigan
Organization of Information Resources,https://www.si.umich.edu/programs/courses/666,University of Michigan
Foundations of Digital Curation,https://www.si.umich.edu/programs/courses/667,University of Michigan
Developing Mobile Experiences,https://www.si.umich.edu/programs/courses/669,University of Michigan
Applied Machine Learning,https://www.si.umich.edu/programs/courses/670,University of Michigan
Data Mining: Methods and Applications,https://www.si.umich.edu/programs/courses/671,University of Michigan
Applied Clinical Informatics,https://www.si.umich.edu/programs/courses/672,University of Michigan
Digitization Cultural Heritage Materials,https://www.si.umich.edu/programs/courses/675,University of Michigan
Preserving Sound and Motion,https://www.si.umich.edu/programs/courses/678,University of Michigan
Advanced User Research in the Field,https://www.si.umich.edu/programs/courses/682,University of Michigan
Designing Consumer-Health Technologies,https://www.si.umich.edu/programs/courses/684,University of Michigan
User-Generated Content,https://www.si.umich.edu/programs/courses/686,University of Michigan
Global Information Engagement Program,https://www.si.umich.edu/programs/courses/688,University of Michigan
Social User Experience,https://www.si.umich.edu/programs/courses/689,University of Michigan
Independent Study,https://www.si.umich.edu/programs/courses/691,University of Michigan
Developing Social Computing,https://www.si.umich.edu/programs/courses/694,University of Michigan
Big Data Analytics,https://www.si.umich.edu/programs/courses/696,University of Michigan
Master's Thesis Option Program,https://www.si.umich.edu/programs/courses/698,University of Michigan
MSI Mastery Courses,https://www.si.umich.edu/programs/courses/699,University of Michigan
Doctoral Foundations Seminar,https://www.si.umich.edu/programs/courses/701,University of Michigan
Seminar in Organizational Studies,https://www.si.umich.edu/programs/courses/702,University of Michigan
First Semester Experience,https://www.si.umich.edu/programs/courses/705,University of Michigan
"Knowledge/Power/Practice in Science, Technology, and Medicine",https://www.si.umich.edu/programs/courses/719,University of Michigan
Data Mining: Methods and Applications,https://www.si.umich.edu/programs/courses/721,University of Michigan
"Qualitative Methods: The purpose of this seminar is to examine, critique current research employing, and begin to utilize a variety of qualitative methods. The course will focus on the design of qualitative studies, selection of data collection method",https://www.si.umich.edu/programs/courses/724,University of Michigan
Unorthodox Research Methods,https://www.si.umich.edu/programs/courses/755,University of Michigan
Research Methods,https://www.si.umich.edu/programs/courses/840,University of Michigan
Research Methods Course in Experimental Methods: This course will be an introduction to experimental methods and some of the major subject areas that have been addressed by laboratory and field experiments. We will discuss basic principles and concret,https://www.si.umich.edu/programs/courses/860,University of Michigan
