Course_Name,Course_Level,Course_Type,Cource_Description,University_Name,Link
Doctor of Philosophy (Integrated),,,,Victoria University,https://www.vu.edu.au/courses/international/UPRA
Bachelor of Physical Education and Sport Science,,,,Victoria University,https://www.vu.edu.au/courses/international/SBPH
Graduate Diploma in Professional Accounting,,,,Victoria University,https://www.vu.edu.au/courses/international/BGAP
Graduate Diploma in Project Management,,,,Victoria University,https://www.vu.edu.au/courses/international/NGPM
Master of Project Management,,,,Victoria University,https://www.vu.edu.au/courses/international/NMPM
Bachelor of Psychological Studies,,,,Victoria University,https://www.vu.edu.au/courses/international/ABPA
Bachelor of Psychological Studies (Honours),,,,Victoria University,https://www.vu.edu.au/courses/international/AHPA
Bachelor of Psychological Studies/Bachelor of Business,,,,Victoria University,https://www.vu.edu.au/courses/international/ABPB
Bachelor of Psychology (Honours),,,,Victoria University,https://www.vu.edu.au/courses/international/ABPC
Master of Public Health (Global Nutrition and Active Living),,,,Victoria University,https://www.vu.edu.au/courses/international/HMPG
Bachelor of Science (Honours) (Biomedical Sciences),,,,Victoria University,https://www.vu.edu.au/courses/international/SHBM
Bachelor of Science (Osteopathy),,,,Victoria University,https://www.vu.edu.au/courses/international/HBSO
Master of Science (Research),,,,Victoria University,https://www.vu.edu.au/courses/international/SRMS
Bachelor of Screen Media,,,,Victoria University,https://www.vu.edu.au/courses/international/ABSN
Bachelor of Social Work,,,,Victoria University,https://www.vu.edu.au/courses/international/ABSW
Graduate Diploma in Sport Business and Integrity,,,,Victoria University,https://www.vu.edu.au/courses/international/SGSI
Master of Sport Business and Integrity,,,,Victoria University,https://www.vu.edu.au/courses/international/SMSI
Diploma of Sport Development,,,,Victoria University,https://www.vu.edu.au/courses/international/SIS50612
Bachelor of Sport Management,,,,Victoria University,https://www.vu.edu.au/courses/international/SBSM
Bachelor of Sport Management/Bachelor of Business,,,,Victoria University,https://www.vu.edu.au/courses/international/SBSB
Bachelor of Sport Science,,,,Victoria University,https://www.vu.edu.au/courses/international/SBSA
Bachelor of Sport Science (Human Movement)/Bachelor of Psychological Studies,,,,Victoria University,https://www.vu.edu.au/courses/international/SBHP
Bachelor of Sport Science (Human Movement)/Bachelor of Sport Management,,,,Victoria University,https://www.vu.edu.au/courses/international/SBHS
Master of Supply Chain Management,,,,Victoria University,https://www.vu.edu.au/courses/international/BMSP
Master of Teaching (Primary Education),,,,Victoria University,https://www.vu.edu.au/courses/international/EMPE
Master of Teaching (Secondary Education),,,,Victoria University,https://www.vu.edu.au/courses/international/EMES
Master of Tourism and Destination Management,,,,Victoria University,https://www.vu.edu.au/courses/international/BMTD
Bachelor of Youth Work,,,,Victoria University,https://www.vu.edu.au/courses/international/ABYW
