Course_Name,Course_Level,Course_Type,Cource_Description,University_Name,Link
Certificate IV in Accounting and Bookkeeping,,,,Victoria University,https://www.vu.edu.au/courses/FNS40217
Diploma of Accounting,,,,Victoria University,https://www.vu.edu.au/courses/FNS50215
Certificate IV in Ageing Support,,,,Victoria University,https://www.vu.edu.au/courses/CHC43015
Certificate IV in Alcohol and Other Drugs,,,,Victoria University,https://www.vu.edu.au/courses/CHC43215
Alcohol and Other Drugs Co-existing Needs Skill Set,,,,Victoria University,https://www.vu.edu.au/courses/CHCSS00092
Alcohol and Other Drugs Skill Set,,,,Victoria University,https://www.vu.edu.au/courses/CHCSS00093
Certificate III in Allied Health Assistance,,,,Victoria University,https://www.vu.edu.au/courses/HLT33015
Master of Applied Information Technology,,,,Victoria University,https://www.vu.edu.au/courses/NMIT
Victorian Certificate of Applied Learning (Intermediate),,,,Victoria University,https://www.vu.edu.au/courses/VCALINT001
Victorian Certificate of Applied Learning (Senior),,,,Victoria University,https://www.vu.edu.au/courses/VCALSEN001
Master of Applied Psychology (Clinical Psychology),,,,Victoria University,https://www.vu.edu.au/courses/AMAL
Master of Applied Psychology (Community Psychology),,,,Victoria University,https://www.vu.edu.au/courses/AMAC
Master of Applied Science,,,,Victoria University,https://www.vu.edu.au/courses/HREH
Bachelor of Arts,,,,Victoria University,https://www.vu.edu.au/courses/ABAB
Master of Arts,,,,Victoria University,https://www.vu.edu.au/courses/HRAT
Master of Arts (Research),,,,Victoria University,https://www.vu.edu.au/courses/ARXF
Master of Arts (Research),,,,Victoria University,https://www.vu.edu.au/courses/ARXH
Master of Arts (Research),,,,Victoria University,https://www.vu.edu.au/courses/ARXL
Certificate III in Barbering,,,,Victoria University,https://www.vu.edu.au/courses/SHB30516
BAS Agent Registration Skill Set,,,,Victoria University,https://www.vu.edu.au/courses/FNSSS00004
Basic Hairstyling Techniques for Make-Up Artists,,,,Victoria University,https://www.vu.edu.au/courses/TNBHA
Basic Scaffolding,,,,Victoria University,https://www.vu.edu.au/courses/TNSCF
Certificate III in Beauty Services,,,,Victoria University,https://www.vu.edu.au/courses/SHB30115
Certificate IV in Beauty Therapy,,,,Victoria University,https://www.vu.edu.au/courses/SHB40115
Diploma of Beauty Therapy,,,,Victoria University,https://www.vu.edu.au/courses/SHB50115
Bachelor of Biomedical and Exercise Science,,,,Victoria University,https://www.vu.edu.au/courses/HBES
Bachelor of Biomedical Science,,,,Victoria University,https://www.vu.edu.au/courses/HBBS
Bachelor of Biomedicine,,,,Victoria University,https://www.vu.edu.au/courses/HBBM
Certificate III in Bricklaying/Blocklaying,,,,Victoria University,https://www.vu.edu.au/courses/CPC30111
Certificate IV in Building and Construction (Building),,,,Victoria University,https://www.vu.edu.au/courses/CPC40110
Diploma of Building and Construction (Building),,,,Victoria University,https://www.vu.edu.au/courses/CPC50210
Certificate IV in Building and Construction (Estimating),,,,Victoria University,https://www.vu.edu.au/courses/CPC40308
Certificate II in Building and Construction Pre-apprenticeship,,,,Victoria University,https://www.vu.edu.au/courses/22338VIC
Bachelor of Building Design,,,,Victoria University,https://www.vu.edu.au/courses/NBBD
Graduate Diploma in Building Fire Safety,,,,Victoria University,https://www.vu.edu.au/courses/NGBF
Advanced Diploma of Building Surveying,,,,Victoria University,https://www.vu.edu.au/courses/CPC60115
Bachelor of Building Surveying,,,,Victoria University,https://www.vu.edu.au/courses/NBBS
Graduate Diploma in Business (Accounting),,,,Victoria University,https://www.vu.edu.au/courses/BGAR
Master of Business (Accounting),,,,Victoria University,https://www.vu.edu.au/courses/BMAK
Master of Business (Accounting)/Master of Finance,,,,Victoria University,https://www.vu.edu.au/courses/BMDD
Diploma of Business Administration,,,,Victoria University,https://www.vu.edu.au/courses/BSB50415
Doctor of Business Administration,,,,Victoria University,https://www.vu.edu.au/courses/BPPB
Graduate Certificate in Business Administration,,,,Victoria University,https://www.vu.edu.au/courses/BTPF
Graduate Diploma in Business Administration,,,,Victoria University,https://www.vu.edu.au/courses/BGPB
Master of Business Administration,,,,Victoria University,https://www.vu.edu.au/courses/BMPF
Master of Business Administration (Professional),,,,Victoria University,https://www.vu.edu.au/courses/BMAB
Graduate Certificate in Business Analytics,,,,Victoria University,https://www.vu.edu.au/courses/BTBI
Graduate Diploma in Business Analytics,,,,Victoria University,https://www.vu.edu.au/courses/BGBI
Master of Business Analytics,,,,Victoria University,https://www.vu.edu.au/courses/BMAD
Master of Business Analytics (Professional),,,,Victoria University,https://www.vu.edu.au/courses/BMBI
Master of Business Analytics/Master of Business Administration,,,,Victoria University,https://www.vu.edu.au/courses/BMDC
Bachelor of Business,,,,Victoria University,https://www.vu.edu.au/courses/BBNS
Master of Business [By Research],,,,Victoria University,https://www.vu.edu.au/courses/BRAM
Certificate II in Business,,,,Victoria University,https://www.vu.edu.au/courses/BSB20115
Certificate III in Business,,,,Victoria University,https://www.vu.edu.au/courses/BSB30115
Certificate IV in Business,,,,Victoria University,https://www.vu.edu.au/courses/BSB40215
Diploma of Business (Enterprise),,,,Victoria University,https://www.vu.edu.au/courses/VDBE
Graduate Diploma in Business (Enterprise Resource Planning Systems),,,,Victoria University,https://www.vu.edu.au/courses/BGEP
Master of Business (Enterprise Resource Planning Systems),,,,Victoria University,https://www.vu.edu.au/courses/BMES
Master of Business (Enterprise Resource Planning Systems)/ Master of Supply Chain Management,,,,Victoria University,https://www.vu.edu.au/courses/BMDB
Master of Business (Enterprise Resource Planning Systems)/Master of Business Analytics,,,,Victoria University,https://www.vu.edu.au/courses/BMDA
Graduate Diploma in Business (Finance),,,,Victoria University,https://www.vu.edu.au/courses/BGBF
Master of Business (Finance),,,,Victoria University,https://www.vu.edu.au/courses/BMFN
Graduate Diploma in Business (Industrial Relations and Human Resource Management),,,,Victoria University,https://www.vu.edu.au/courses/BGIH
Master of Business (Industrial Relations/Human Resource Management),,,,Victoria University,https://www.vu.edu.au/courses/BMIR
Graduate Diploma in Business (Management),,,,Victoria University,https://www.vu.edu.au/courses/BGMA
Master of Business (Management),,,,Victoria University,https://www.vu.edu.au/courses/BMMA
Graduate Diploma in Business (Marketing),,,,Victoria University,https://www.vu.edu.au/courses/BGMK
Master of Business (Marketing),,,,Victoria University,https://www.vu.edu.au/courses/BMMK
Graduate Diploma in Business (Supply Chain Management),,,,Victoria University,https://www.vu.edu.au/courses/BGBS
Master of Business (Supply Chain Management),,,,Victoria University,https://www.vu.edu.au/courses/BMSM
Master of Business (Tourism and Destination Management),,,,Victoria University,https://www.vu.edu.au/courses/BMBT
Certificate III in Cabinet Making,,,,Victoria University,https://www.vu.edu.au/courses/MSF31113
Certificate III in Carpentry and Joinery,,,,Victoria University,https://www.vu.edu.au/courses/CPC32011
Certificate III in Carpentry,,,,Victoria University,https://www.vu.edu.au/courses/CPC30211
"Master of Change, Innovation and Leadership",,,,Victoria University,https://www.vu.edu.au/courses/BMCH
Chinese Language and Culture Program,,,,Victoria University,https://www.vu.edu.au/courses/JQAK
Certificate II in Civil Construction,,,,Victoria University,https://www.vu.edu.au/courses/RII20715
Certificate III in Civil Construction,,,,Victoria University,https://www.vu.edu.au/courses/RII30915
Certificate IV in Civil Construction Operations,,,,Victoria University,https://www.vu.edu.au/courses/RII40615
Certificate III in Civil Construction Plant Operations,,,,Victoria University,https://www.vu.edu.au/courses/RII30815
Certificate IV in Civil Construction Supervision,,,,Victoria University,https://www.vu.edu.au/courses/RII40715
Class 1 Restricted Electrical Fault Finding Licence,,,,Victoria University,https://www.vu.edu.au/courses/TNCL1
Certificate III in Cleaning Operations,,,,Victoria University,https://www.vu.edu.au/courses/CPP30316
Certificate IV in Clinical Classification,,,,Victoria University,https://www.vu.edu.au/courses/22274VIC
Master of Clinical Exercise Science and Rehabilitation,,,,Victoria University,https://www.vu.edu.au/courses/AMEP
Introduction to Clipper Fading,,,,Victoria University,https://www.vu.edu.au/courses/THAAE
Certificate III in Commercial Cookery,,,,Victoria University,https://www.vu.edu.au/courses/SIT30816
Certificate IV in Commercial Cookery,,,,Victoria University,https://www.vu.edu.au/courses/SIT40516
Bachelor of Community Development,,,,Victoria University,https://www.vu.edu.au/courses/ABCD
Diploma of Community Development,,,,Victoria University,https://www.vu.edu.au/courses/CHC52115
Advanced Diploma of Community Sector Management,,,,Victoria University,https://www.vu.edu.au/courses/CHC62015
Certificate II in Community Services,,,,Victoria University,https://www.vu.edu.au/courses/CHC22015
Certificate III in Community Services,,,,Victoria University,https://www.vu.edu.au/courses/CHC32015
Certificate IV in Community Services,,,,Victoria University,https://www.vu.edu.au/courses/CHC42015
Diploma of Community Services,,,,Victoria University,https://www.vu.edu.au/courses/CHC52015
Graduate Certificate in Community Sport Management,,,,Victoria University,https://www.vu.edu.au/courses/STSC
Certificate IV in Computer Systems Technology,,,,Victoria University,https://www.vu.edu.au/courses/ICT41015
Confined Spaces Induction,,,,Victoria University,https://www.vu.edu.au/courses/TNAAG
Construction Induction (White Card),,,,Victoria University,https://www.vu.edu.au/courses/TNAAA
Bachelor of Construction Management (Honours),,,,Victoria University,https://www.vu.edu.au/courses/NHCM
Graduate Diploma in Counselling,,,,Victoria University,https://www.vu.edu.au/courses/AGPD
Master of Counselling,,,,Victoria University,https://www.vu.edu.au/courses/AMPE
CPR (Refresher),,,,Victoria University,https://www.vu.edu.au/courses/WNE31
Creative Writing,,,,Victoria University,https://www.vu.edu.au/courses/THAAD
Bachelor of Criminal Justice and Psychological Studies,,,,Victoria University,https://www.vu.edu.au/courses/ABCY
Bachelor of Criminal Justice,,,,Victoria University,https://www.vu.edu.au/courses/ABCJ
Bachelor of Criminology,,,,Victoria University,https://www.vu.edu.au/courses/LBCR
Bachelor of Dermal Sciences,,,,Victoria University,https://www.vu.edu.au/courses/HBDS
Certificate IV in Design,,,,Victoria University,https://www.vu.edu.au/courses/CUA40715
Graduate Certificate in Digital Media,,,,Victoria University,https://www.vu.edu.au/courses/ATDM
Graduate Diploma in Digital Media,,,,Victoria University,https://www.vu.edu.au/courses/AGDM
Master of Digital Media,,,,Victoria University,https://www.vu.edu.au/courses/AMDM
Certificate IV in Disability,,,,Victoria University,https://www.vu.edu.au/courses/CHC43115
Restricted - Disconnection / Reconnection of Fixed Wired Low Voltage Appliances,,,,Victoria University,https://www.vu.edu.au/courses/UEESS00093
Restricted - Disconnection / Reconnection of Fixed Wired Low Voltage Composite Appliances,,,,Victoria University,https://www.vu.edu.au/courses/UEESS00097
Restricted - Disconnection / Reconnection of Fixed Wired Low Voltage Control Devices,,,,Victoria University,https://www.vu.edu.au/courses/UEESS00094
Restricted - Disconnection / Reconnection of Fixed Wired Low Voltage Water Heaters,,,,Victoria University,https://www.vu.edu.au/courses/UEESS00096
Restricted - Disconnection/Reconnection of Fixed Wired Low Voltage Motors,,,,Victoria University,https://www.vu.edu.au/courses/UEESS00095
Certificate I in EAL (Access),,,,Victoria University,https://www.vu.edu.au/courses/22250VIC
Certificate II in EAL (Access),,,,Victoria University,https://www.vu.edu.au/courses/22251VIC
Certificate III in EAL (Access),,,,Victoria University,https://www.vu.edu.au/courses/22253VIC
Certificate IV in EAL (Access),,,,Victoria University,https://www.vu.edu.au/courses/22256VIC
Certificate II in EAL (Employment),,,,Victoria University,https://www.vu.edu.au/courses/22252VIC
Certificate III in EAL (Employment),,,,Victoria University,https://www.vu.edu.au/courses/22254VIC
Certificate III in EAL (Further Study),,,,Victoria University,https://www.vu.edu.au/courses/22255VIC
Certificate IV in EAL (Further Study),,,,Victoria University,https://www.vu.edu.au/courses/22258VIC
Certificate III in Early Childhood Education and Care,,,,Victoria University,https://www.vu.edu.au/courses/CHC30113
Diploma of Early Childhood Education and Care,,,,Victoria University,https://www.vu.edu.au/courses/CHC50113
Bachelor of Early Childhood Education,,,,Victoria University,https://www.vu.edu.au/courses/EBEC
Graduate Diploma in Early Childhood Education,,,,Victoria University,https://www.vu.edu.au/courses/EGEC
Graduate Certificate in Education,,,,Victoria University,https://www.vu.edu.au/courses/ETED
Graduate Diploma in Education,,,,Victoria University,https://www.vu.edu.au/courses/EGED
Master of Education,,,,Victoria University,https://www.vu.edu.au/courses/HRED
Master of Education,,,,Victoria University,https://www.vu.edu.au/courses/EMED
Bachelor of Education (P-12),,,,Victoria University,https://www.vu.edu.au/courses/EBED
Bachelor of Education Studies,,,,Victoria University,https://www.vu.edu.au/courses/EBST
Diploma of Education Studies,,,,Victoria University,https://www.vu.edu.au/courses/EDES
Certificate IV in Education Support,,,,Victoria University,https://www.vu.edu.au/courses/CHC40213
Victorian Certificate of Education (VCE),,,,Victoria University,https://www.vu.edu.au/courses/VCE0000001
Restricted - Electrical Safety Testing of Electrical Cord Connected Equipment and Cord Assemblies,,,,Victoria University,https://www.vu.edu.au/courses/UEESS00098
Certificate III in Electrotechnology Electrician,,,,Victoria University,https://www.vu.edu.au/courses/UEE30811
Certificate II in Electrotechnology Studies (Pre-Vocational),,,,Victoria University,https://www.vu.edu.au/courses/22261VIC
Diploma of Engineering - Advanced Trade,,,,Victoria University,https://www.vu.edu.au/courses/MEM50105
Master of Engineering (By Research),,,,Victoria University,https://www.vu.edu.au/courses/ERIT
Certificate II in Engineering,,,,Victoria University,https://www.vu.edu.au/courses/MEM20105
Certificate IV in Engineering,,,,Victoria University,https://www.vu.edu.au/courses/MEM40105
Diploma of Engineering,,,,Victoria University,https://www.vu.edu.au/courses/VDEN
Certificate III in Engineering - Fabrication Trade,,,,Victoria University,https://www.vu.edu.au/courses/MEM30305
Bachelor of Engineering (Honours) (Architectural Engineering),,,,Victoria University,https://www.vu.edu.au/courses/NHEA
Bachelor of Engineering (Honours) (Civil Engineering),,,,Victoria University,https://www.vu.edu.au/courses/NHEC
Bachelor of Engineering (Honours) (Electrical and Electronic Engineering),,,,Victoria University,https://www.vu.edu.au/courses/NHEE
Bachelor of Engineering (Honours) (Mechanical Engineering),,,,Victoria University,https://www.vu.edu.au/courses/NHEM
Master of Engineering,,,,Victoria University,https://www.vu.edu.au/courses/NMEN
Certificate III in Engineering - Mechanical Trade,,,,Victoria University,https://www.vu.edu.au/courses/MEM30205
Diploma of Engineering Technology,,,,Victoria University,https://www.vu.edu.au/courses/22478VIC
Advanced Diploma of Engineering Technology - Electrical,,,,Victoria University,https://www.vu.edu.au/courses/UEE62111
English for Academic Purposes (EAP),,,,Victoria University,https://www.vu.edu.au/courses/VNEAP
English for BULATS Preparation,,,,Victoria University,https://www.vu.edu.au/courses/VNEBP
Graduate Certificate in Enterprise and Resource Planning Systems,,,,Victoria University,https://www.vu.edu.au/courses/BTEN
Master of Enterprise Resource Planning Management,,,,Victoria University,https://www.vu.edu.au/courses/BMEP
Diploma of Event Management,,,,Victoria University,https://www.vu.edu.au/courses/SIT50316
Bachelor of Exercise Science (Clinical Practice),,,,Victoria University,https://www.vu.edu.au/courses/ABHE
Bachelor of Exercise Science (Sport Practice),,,,Victoria University,https://www.vu.edu.au/courses/ABHD
Eyelash Extensions,,,,Victoria University,https://www.vu.edu.au/courses/TNAAE
Graduate Certificate in Finance,,,,Victoria University,https://www.vu.edu.au/courses/BTFF
Master of Finance,,,,Victoria University,https://www.vu.edu.au/courses/BMFF
Bachelor of Fitness,,,,Victoria University,https://www.vu.edu.au/courses/SBFI
Certificate III in Fitness,,,,Victoria University,https://www.vu.edu.au/courses/SIS30315
Certificate IV in Fitness,,,,Victoria University,https://www.vu.edu.au/courses/SIS40215
Food Safety Handlers (Hospitality),,,,Victoria University,https://www.vu.edu.au/courses/TNAAB
Food Safety Supervisor (Hospitality),,,,Victoria University,https://www.vu.edu.au/courses/TNAAC
Foundations at VU,,,,Victoria University,https://www.vu.edu.au/courses/JYAC
Funeral Celebrancy,,,,Victoria University,https://www.vu.edu.au/courses/TNFCY
Certificate II in Furniture Finishing,,,,Victoria University,https://www.vu.edu.au/courses/MSF20213
Certificate II in Furniture Making,,,,Victoria University,https://www.vu.edu.au/courses/MSF20313
Certificate I in General Education for Adults,,,,Victoria University,https://www.vu.edu.au/courses/22472VIC
Certificate II in General Education for Adults,,,,Victoria University,https://www.vu.edu.au/courses/22473VIC
Certificate III in General Education for Adults,,,,Victoria University,https://www.vu.edu.au/courses/22474VIC
Certificate I in General Education for Adults (Introductory),,,,Victoria University,https://www.vu.edu.au/courses/22476VIC
General English,,,,Victoria University,https://www.vu.edu.au/courses/VNGEN
Advanced Diploma of Graphic Design,,,,Victoria University,https://www.vu.edu.au/courses/CUA60315
Diploma of Graphic Design,,,,Victoria University,https://www.vu.edu.au/courses/CUA50715
Certificate III in Hairdressing,,,,Victoria University,https://www.vu.edu.au/courses/SHB30416
Certificate III in Health Administration,,,,Victoria University,https://www.vu.edu.au/courses/HLT37315
Diploma of Health Coaching,,,,Victoria University,https://www.vu.edu.au/courses/10237NAT
Bachelor of Health Science,,,,Victoria University,https://www.vu.edu.au/courses/HBHL
Master of Health Science (Osteopathy),,,,Victoria University,https://www.vu.edu.au/courses/HMHO
Certificate III in Health Services Assistance,,,,Victoria University,https://www.vu.edu.au/courses/HLT33115
Certificate III in Health Support Services,,,,Victoria University,https://www.vu.edu.au/courses/HLT33215
Associate Degree in Hospitality and Hotel Management,,,,Victoria University,https://www.vu.edu.au/courses/VAHH
Certificate II in Hospitality,,,,Victoria University,https://www.vu.edu.au/courses/SIT20316
Certificate III in Hospitality,,,,Victoria University,https://www.vu.edu.au/courses/SIT30616
Advanced Diploma of Hospitality Management,,,,Victoria University,https://www.vu.edu.au/courses/SIT60316
Diploma of Hospitality Management,,,,Victoria University,https://www.vu.edu.au/courses/SIT50416
Bachelor of Human Nutrition,,,,Victoria University,https://www.vu.edu.au/courses/HBNT
Certificate IV in Human Resources,,,,Victoria University,https://www.vu.edu.au/courses/BSB41015
HVAC and BMS Controls Training Short Course,,,,Victoria University,https://www.vu.edu.au/courses/JTE01
Certificate III in Individual Support,,,,Victoria University,https://www.vu.edu.au/courses/CHC33015
Certificate IV in Industrial Automation and Control,,,,Victoria University,https://www.vu.edu.au/courses/UEE43211
Graduate Certificate in Industrial Relations and Human Resource Management,,,,Victoria University,https://www.vu.edu.au/courses/BTIH
Master of Industrial Relations and Human Resource Management,,,,Victoria University,https://www.vu.edu.au/courses/BMIH
"Certificate II in Information, Digital Media and Technology",,,,Victoria University,https://www.vu.edu.au/courses/ICT20115
"Certificate III in Information, Digital Media and Technology",,,,Victoria University,https://www.vu.edu.au/courses/ICT30115
Bachelor of Information Technology,,,,Victoria University,https://www.vu.edu.au/courses/NBIT
Diploma of Information Technology,,,,Victoria University,https://www.vu.edu.au/courses/VDIT
Diploma of Information Technology Networking,,,,Victoria University,https://www.vu.edu.au/courses/ICT50415
Bachelor of Information Technology (Professional),,,,Victoria University,https://www.vu.edu.au/courses/NBIP
Graduate Certificate in International Community Development	,,,,Victoria University,https://www.vu.edu.au/courses/ATID
Graduate Diploma in International Community Development	,,,,Victoria University,https://www.vu.edu.au/courses/AGID
Master of International Community Development,,,,Victoria University,https://www.vu.edu.au/courses/AMCD
International Foundations at VU,,,,Victoria University,https://www.vu.edu.au/courses/JQAG
International Foundations at VU (Extended),,,,Victoria University,https://www.vu.edu.au/courses/JQAH
Course in Introduction to the National Disability Insurance Scheme,,,,Victoria University,https://www.vu.edu.au/courses/22469VIC
Certificate III in Joinery,,,,Victoria University,https://www.vu.edu.au/courses/CPC31912
Certificate II in Kitchen Operations,,,,Victoria University,https://www.vu.edu.au/courses/SIT20416
LANTITE Preparation Course,,,,Victoria University,https://www.vu.edu.au/courses/THAAA
Bachelor of Laws,,,,Victoria University,https://www.vu.edu.au/courses/BLAW
Bachelor of Laws/ Bachelor of Criminology,,,,Victoria University,https://www.vu.edu.au/courses/LBLC
Master of Laws (By Research),,,,Victoria University,https://www.vu.edu.au/courses/BMLT
Bachelor of Laws (Graduate Entry),,,,Victoria University,https://www.vu.edu.au/courses/BLGE
Bachelor of Laws (Honours),,,,Victoria University,https://www.vu.edu.au/courses/LHLW
Bachelor of Laws (Honours) (Graduate Entry),,,,Victoria University,https://www.vu.edu.au/courses/LHGE
Bachelor of Laws (Honours)/Bachelor of Arts,,,,Victoria University,https://www.vu.edu.au/courses/LHWA
Bachelor of Laws (Honours)/Bachelor of Business,,,,Victoria University,https://www.vu.edu.au/courses/LHLB
Bachelor of Laws (Honours)/Bachelor of Psychology (Honours),,,,Victoria University,https://www.vu.edu.au/courses/LHWP
Bachelor of Laws/Bachelor of Arts,,,,Victoria University,https://www.vu.edu.au/courses/LBLA
Bachelor of Laws/Bachelor of Business,,,,Victoria University,https://www.vu.edu.au/courses/BBLL
Bachelor of Laws/Bachelor of Psychological Studies,,,,Victoria University,https://www.vu.edu.au/courses/LBWP
Certificate IV in Leadership and Management,,,,Victoria University,https://www.vu.edu.au/courses/BSB42015
Diploma of Leadership and Management,,,,Victoria University,https://www.vu.edu.au/courses/BSB51915
Advanced Diploma of Legal Practice,,,,Victoria University,https://www.vu.edu.au/courses/22276VIC
Bachelor of Legal Services,,,,Victoria University,https://www.vu.edu.au/courses/LBLS
Diploma of Legal Services,,,,Victoria University,https://www.vu.edu.au/courses/BSB52215
Certificate IV in Liberal Arts,,,,Victoria University,https://www.vu.edu.au/courses/22317VIC
Certificate IV in Library and Information Services,,,,Victoria University,https://www.vu.edu.au/courses/BSB42115
Diploma of Library and Information Services,,,,Victoria University,https://www.vu.edu.au/courses/BSB52115
Certificate II in Logistics,,,,Victoria University,https://www.vu.edu.au/courses/TLI21815
Certificate III in Logistics,,,,Victoria University,https://www.vu.edu.au/courses/TLI32416
Certificate IV in Logistics,,,,Victoria University,https://www.vu.edu.au/courses/TLI42016
Diploma of Logistics,,,,Victoria University,https://www.vu.edu.au/courses/TLI50415
Make-Up Basics,,,,Victoria University,https://www.vu.edu.au/courses/TNMUB
Certificate III in Make-Up,,,,Victoria University,https://www.vu.edu.au/courses/SHB30215
Graduate Certificate in Management,,,,Victoria University,https://www.vu.edu.au/courses/22443VIC
Graduate Certificate in Management,,,,Victoria University,https://www.vu.edu.au/courses/BTMM
Master of Management,,,,Victoria University,https://www.vu.edu.au/courses/BMMM
Graduate Certificate in Marketing,,,,Victoria University,https://www.vu.edu.au/courses/BTKM
Master of Marketing,,,,Victoria University,https://www.vu.edu.au/courses/BMKM
Micropigmentation and Cosmetic Tattooing for Professionals,,,,Victoria University,https://www.vu.edu.au/courses/JQMP
Bachelor of Midwifery/Bachelor of Nursing,,,,Victoria University,https://www.vu.edu.au/courses/HBMA
Graduate Diploma in Migration Law,,,,Victoria University,https://www.vu.edu.au/courses/LGML
Bachelor of Music,,,,Victoria University,https://www.vu.edu.au/courses/ABMC
Advanced Diploma of Music Industry,,,,Victoria University,https://www.vu.edu.au/courses/CUA60515
Certificate III in Music Industry,,,,Victoria University,https://www.vu.edu.au/courses/CUA30915
Certificate IV in Music Industry,,,,Victoria University,https://www.vu.edu.au/courses/CUA40915
Advanced Diploma of Myotherapy,,,,Victoria University,https://www.vu.edu.au/courses/22316VIC
Bachelor of Nursing,,,,Victoria University,https://www.vu.edu.au/courses/HBNB
