Course_Name,Course_Level,Course_Type,Cource_Description,University_Name,Link
Master of Science (Social Sciences),Postgraduate,,,University of Tasmania,http://utas.edu.au/courses/X8D
Master of Social Work,Postgraduate,,,University of Tasmania,http://utas.edu.au/courses/R8B
Master of Social Work,Postgraduate,,,University of Tasmania,http://utas.edu.au/courses/R7N
Master of Social Work (Advanced Practice),Postgraduate,,,University of Tasmania,http://utas.edu.au/courses/R7H
Master of Social Work (Qualifying),Postgraduate,,,University of Tasmania,http://utas.edu.au/courses/R7O
Graduate Certificate in Teaching Digital Technologies,Postgraduate,,,University of Tasmania,http://utas.edu.au/courses/E5K
Graduate Certificate in Timber (Processing & Building),Postgraduate,,,University of Tasmania,http://utas.edu.au/courses/K5E
Master of Teaching,Postgraduate,,,University of Tasmania,http://utas.edu.au/courses/E7G
Graduate Certificate in University Learning and Teaching,Postgraduate,,,University of Tasmania,http://utas.edu.au/courses/E5T
Graduate Certificate in Workplace Conflict Management,Postgraduate,,,University of Tasmania,http://utas.edu.au/courses/L5D
