Course_Name,Course_Level,Course_Type,Cource_Description,University_Name,Link
Bachelor of Forensic Science (Honours),Undergraduate,,Extend your prior learning of forensic science to gain a deeper understanding of your chosen field through research exploration within this honours degree.,Deakin University,http://www.deakin.edu.au/course/bachelor-forensic-science-honours
Bachelor of Environmental Science (Honours),Undergraduate,,Extend your learning in environmental science to gain a deeper understanding of your chosen discipline with research exploration in this honours degree.,Deakin University,http://www.deakin.edu.au/course/bachelor-environmental-science-honours
Bachelor of Information Technology (Honours),Undergraduate,,Extend your prior learning in IT to gain a deeper understanding of your chosen discipline through research exploration within this honours degree.,Deakin University,http://www.deakin.edu.au/course/bachelor-information-technology-honours
Bachelor of Science (Honours),Undergraduate,,Extend your prior learning in science to gain a deeper understanding of your chosen discipline through research exploration within this honours degree.,Deakin University,http://www.deakin.edu.au/course/bachelor-science-honours
Bachelor of Medical Imaging,Undergraduate,,"Deakin's Bachelor of Medical Imaging offers training in several techniques from ultrasounds to MRI, preparing undergrads for a career in the medical field.",Deakin University,http://www.deakin.edu.au/course/bachelor-medical-imaging
Bachelor of Commerce/Bachelor of Business Analytics,Undergraduate,,"Deakin's double degrees in Bachelor of Commerce/Bachelor of Business Analytics (previously Bachelor of Commerce/Bachelor of Information Systems) are professionally accredited, giving students an edge in the job market.",Deakin University,http://www.deakin.edu.au/course/bachelor-commerce-bachelor-business-analytics
Bachelor of Environmental Science (Wildlife and Conservation Biology),Undergraduate,,"Learn how to handle native animals, survey wildlife populations and conduct sustainability assessments as a wildlife and conservation biology student.",Deakin University,http://www.deakin.edu.au/course/bachelor-environmental-science-wildlife-and-conservation-biology
"Bachelor of Film, Television and Animation",Undergraduate,,"This undergraduate degree will expose you to cutting-edge technologies, filmmaking and screen-writing while gaining practical experience in screen production.",Deakin University,http://www.deakin.edu.au/course/bachelor-film-television-and-animation
Bachelor of Arts (Honours),Undergraduate,,The Bachelor of Arts (Honours) allows you to design your own course with a chosen specialisation in a field you are passionate about.,Deakin University,http://www.deakin.edu.au/course/bachelor-arts-honours
Bachelor of Arts/Master of Arts (International Relations),Undergraduate,,The Bachelor / Master of Arts (International Relations) aims to produce graduates who can demonstrate high levels of theoretical and empirical analysis.,Deakin University,http://www.deakin.edu.au/course/bachelor-arts-master-arts-international-relations
Bachelor of Civil Engineering (Honours),Undergraduate,,"Learn to inspire the design, construction and management of civil infrastructure in an internationally recognised degree that opens global opportunities.",Deakin University,http://www.deakin.edu.au/course/bachelor-civil-engineering-honours
Bachelor of Construction Management (Honours)/Bachelor of Property and Real Estate,Undergraduate,,"Combine studies in construction management, property and real estate to build the skills required to excel in this fast-paced and growing field.",Deakin University,http://www.deakin.edu.au/course/bachelor-construction-management-honours-bachelor-property-and-real-estate
Bachelor of Design (Architecture),Undergraduate,,"Immerse yourself in our architecture degree to explore innovative real-world projects and learn about architectural ideas, building science and design.",Deakin University,http://www.deakin.edu.au/course/bachelor-design-architecture
Bachelor of Mechatronics Engineering (Honours),Undergraduate,,"Mix electrical, mechanical and robotics engineering into a single degree and you could land a career shaping the innovative robotics systems of the future.",Deakin University,http://www.deakin.edu.au/course/bachelor-mechatronics-engineering-honours
Diploma of Indonesian,Undergraduate,,This undergraduate course will sharpen your language skills and extend your cultural understanding. Apply today and get the opportunity to study abroad.,Deakin University,http://www.deakin.edu.au/course/diploma-indonesian
Bachelor of Arts (Psychology) (Honours),Undergraduate,,The Bachelor of Arts (Psychology) (Honours) prepares you for further postgraduate study and is useful when pursuing a career as a psychologist.,Deakin University,http://www.deakin.edu.au/course/bachelor-arts-psychology-honours
Bachelor of Nursing (Clinical Leadership),Undergraduate,,Gain hands-on skills and develop leadership potential with Deakin's Bachelor of Nursing (Clinical Leadership) - the only course of its kind in Victoria.,Deakin University,http://www.deakin.edu.au/course/bachelor-nursing-clinical-leadership
Diploma of Arabic,Undergraduate,,"Boost your employability, develop your linguistic skills and expand your career and study pathways with a Diploma of Arabic. Enquire and apply today.",Deakin University,http://www.deakin.edu.au/course/diploma-arabic
Bachelor of Arts/Master of Teaching (Secondary),Undergraduate,,Fast-track your studies and gain a postgraduate teaching qualification with Deakin's specialised arts teaching degree.,Deakin University,http://www.deakin.edu.au/course/bachelor-arts-master-teaching-secondary
Bachelor of Nursing/Bachelor of Psychological Science,Undergraduate,,"This undergraduate course encourages you to develop knowledge and understanding in human behaviour. Upon completion, you graduate as a Registered Nurse.",Deakin University,http://www.deakin.edu.au/course/bachelor-nursing-bachelor-psychological-science
Bachelor of Public Health and Health Promotion (Honours),Undergraduate,,Develop your research and investigative skills with a Bachelor of Public Health and Health Promotion (Honours) at Deakin.,Deakin University,http://www.deakin.edu.au/course/bachelor-public-health-and-health-promotion-honours
Bachelor of Science/Master of Teaching (Secondary),Undergraduate,,Fast-track your studies and gain a postgraduate teaching qualification with Deakin's specialised science teaching degree.,Deakin University,http://www.deakin.edu.au/course/bachelor-science-master-teaching-secondary
Bachelor of Sport Development,Undergraduate,,"The Bachelor of Sport Development provides insights into sport development, management and science, allowing you to develop a rewarding career in sport.",Deakin University,http://www.deakin.edu.au/course/bachelor-sport-development
Bachelor of Arts - Advanced (Honours),Undergraduate,,"Choose Deakin's Bachelor of Arts - Advanced (Honours) to gain extensive knowledge in a disciplinary area within social sciences, humanities and the arts.",Deakin University,http://www.deakin.edu.au/course/bachelor-arts-advanced-honours
Bachelor of Creative Arts (Drama),Undergraduate,,"Through Deakin's Bachelor of Creative Arts (Drama), develop your technical skills, learn theatre history and take overseas study tours and internships.",Deakin University,http://www.deakin.edu.au/course/bachelor-creative-arts-drama
Bachelor of Cyber Security,Undergraduate,,"Secure your digital future through exploration of best practice in the identification, diagnosis, analysis and management of cyber security challenges.",Deakin University,http://www.deakin.edu.au/course/bachelor-cyber-security
Bachelor of Education (Early Years),Undergraduate,,"As a dual accredited degree, the Bachelor of Education (Early Years) course provides flexible employment options in a variety of early year education settings.",Deakin University,http://www.deakin.edu.au/course/bachelor-education-early-years
Bachelor of Information Technology,Undergraduate,,Choose from a range of creative and technical specialisations to suit your career aspirations and acquire IT skills that are vital to every industry.,Deakin University,http://www.deakin.edu.au/course/bachelor-information-technology
Bachelor of Mechanical Engineering (Honours),Undergraduate,,"Get the design, engineering and entrepreneurial skills required to develop and run the complex mechanical systems, devices and machines of the future.",Deakin University,http://www.deakin.edu.au/course/bachelor-mechanical-engineering-honours
Bachelor of Arts/Bachelor of Science,Undergraduate,,Combine studies in arts and science within the Bachelor of Arts/Bachelor of Science double degree and get a competitive edge in your chosen career.,Deakin University,http://www.deakin.edu.au/course/bachelor-arts-bachelor-science
Bachelor of Communication (Journalism),Undergraduate,,"A Bachelor of Communication (Journalism) prepares you for the changing media climate, providing graduates with skills to work across all news platforms.",Deakin University,http://www.deakin.edu.au/course/bachelor-communication-journalism
Bachelor of Communication (Public Relations),Undergraduate,,Deakin's Bachelor of Communication (Public Relations) will ready you with strategic communication methods to take on the changing media landscape.,Deakin University,http://www.deakin.edu.au/course/bachelor-communication-public-relations
Bachelor of Creative Arts (Photography),Undergraduate,,Unleash your creativity via Deakin's Bachelor of Creative Arts (Photography) and gain technical skills using our state-of-the-art equipment and facilities. All applicants need to submit a portfolio to Deakin. See details in the entry requirements below.,Deakin University,http://www.deakin.edu.au/course/bachelor-creative-arts-photography
Bachelor of Health Sciences/Bachelor of Arts,Undergraduate,,"In our undergraduate Health Science and Arts course, you will be provided the range to find a specialisation that suits your interests. Apply today.",Deakin University,http://www.deakin.edu.au/course/bachelor-health-sciences-bachelor-arts
Bachelor of International Studies,Undergraduate,,"Through Deakin's Bachelor of International Studies, you can study for a time at an overseas university or intern at an organisation overseas.",Deakin University,http://www.deakin.edu.au/course/bachelor-international-studies
Bachelor of Communication (Honours),Undergraduate,,"The Bachelor of Communication (Honours) provides you with an advanced study in media disciplines including Advertising, Digital Media, Journalism and Public Relations.",Deakin University,http://www.deakin.edu.au/course/bachelor-communication-honours
Associate Degree of Arts,Undergraduate,,The Associate Degree of Arts is a flexible undergraduate course providing you with the required support to thrive.,Deakin University,http://www.deakin.edu.au/course/associate-degree-arts
Bachelor of Arts,Undergraduate,,"Open up a world of career options by studying a Bachelor of Arts. With various specialisations and work placements, you can pursue your passion at Deakin.",Deakin University,http://www.deakin.edu.au/course/bachelor-arts
Bachelor of Business (Sport Management),Undergraduate,,Deakin's Bachelor of Business (Sport Management) teaches you about the business aspects of sport from financial and promotional to legal and managerial.,Deakin University,http://www.deakin.edu.au/course/bachelor-business-sport-management
Bachelor of Commerce,Undergraduate,,"Study Deakin's Bachelor of Commerce to gain a wealth of business knowledge and skills through course material, internships and international experiences.",Deakin University,http://www.deakin.edu.au/course/bachelor-commerce
Bachelor of Commerce/Bachelor of Laws,Undergraduate,,Broaden your skillset and industry knowledge of both business and legal studies through Deakin's Bachelor of Commerce/Bachelor of Laws combined degree.,Deakin University,http://www.deakin.edu.au/course/bachelor-commerce-bachelor-laws
Bachelor of Commerce/Bachelor of Science,Undergraduate,,"Deakin's Bachelor of Commerce/Bachelor of Science will give you a unique skillset for business, marketing or management roles within the science industry.",Deakin University,http://www.deakin.edu.au/course/bachelor-commerce-bachelor-science
Bachelor of Design (3D Animation),Undergraduate,,Learn the animation techniques required to become a successful motion designer. All applicants for the Bachelor of Design (3D Animation) need to submit a portfolio to Deakin. See details in the Entry Requirements.,Deakin University,http://www.deakin.edu.au/course/bachelor-design-3d-animation
Bachelor of International Studies/Bachelor of Commerce,Undergraduate,,"In Deakin's International Studies / Commerce double degree, you will be able to find your career path through specialisations and overseas internships.",Deakin University,http://www.deakin.edu.au/course/bachelor-international-studies-bachelor-commerce
Bachelor of Nursing,Undergraduate,,"Enrol in Deakin's Bachelor of Nursing to gain the knowledge, skills and ethical understanding you need to become a competent and successful nurse clinician.",Deakin University,http://www.deakin.edu.au/course/bachelor-nursing
Bachelor of Psychology (Honours),Undergraduate,,Understand human behaviour and gain registration as a psychologist with the Psychology Board of Australia via Deakin's Bachelor of Psychology (Honours).,Deakin University,http://www.deakin.edu.au/course/bachelor-psychology-honours
Bachelor of Arts/Bachelor of Laws,Undergraduate,,Deakin's Bachelor of Arts/Bachelor of Laws course lets you graduate with two degrees and study thought-provoking subjects from criminal law to philosophy.,Deakin University,http://www.deakin.edu.au/course/bachelor-arts-bachelor-laws
Bachelor of Criminology/Bachelor of Laws,Undergraduate,,This unique undergraduate course combines the fields of criminology and law to provide you with a wide range of exciting career opportunities.,Deakin University,http://www.deakin.edu.au/course/bachelor-criminology-bachelor-laws
Bachelor of Environmental Science (Marine Biology),Undergraduate,,Gain extensive hands-on experience exploring coastal ecosystems and marine environments with some of the highest biological diversity in Australia.,Deakin University,http://www.deakin.edu.au/course/bachelor-environmental-science-marine-biology
Bachelor of Forensic Science,Undergraduate,,"Study the only accredited forensic science degree in the Asia Pacific region. Learn to collect, interpret and present evidence; and hone courtroom skills.",Deakin University,http://www.deakin.edu.au/course/bachelor-forensic-science
Bachelor of Laws,Undergraduate,,Study Deakin's Bachelor of Laws to become an outstanding commercial lawyer and benefit from taking part in a sought-after work placement program.,Deakin University,http://www.deakin.edu.au/course/bachelor-laws
Bachelor of Nutrition Science/Bachelor of Commerce,Undergraduate,,The Bachelor of Nutrition Science/Commerce challenges you to improve how business operates in the food and nutrition industry. Learn more today.,Deakin University,http://www.deakin.edu.au/course/bachelor-nutrition-science-bachelor-commerce
Bachelor of Creative Arts (Honours),Undergraduate,,The Bachelor of Creative Arts (Honours) allows you to build upon your current skills and knowledge by undertaking advanced creative projects.,Deakin University,http://www.deakin.edu.au/course/bachelor-creative-arts-honours
Bachelor of Health Sciences (Honours),Undergraduate,,Enhance your graduate skills and employability by undertaking a Bachelor of Health Sciences (Honours) at Deakin University.,Deakin University,http://www.deakin.edu.au/course/bachelor-health-sciences-honours
Diploma of Chinese,Undergraduate,,Gain a global perspective with a Diploma of Chinese at Deakin and learn how to write and converse in the language with ease. Enquire and apply today.,Deakin University,http://www.deakin.edu.au/course/diploma-chinese
Diploma of Spanish,Undergraduate,,Deakin's Diploma of Spanish welcomes students of all learning stages to develop their language skills and develop cultural understanding. Apply today.,Deakin University,http://www.deakin.edu.au/course/diploma-spanish
Bachelor of Arts/Bachelor of Commerce,Undergraduate,,"Gain two qualifications via Deakin's Bachelor of Arts/Bachelor of Commerce, where you'll gather insights in business, communication and critical analysis.",Deakin University,http://www.deakin.edu.au/course/bachelor-arts-bachelor-commerce
Bachelor of Arts (Psychology),Undergraduate,,"Deakin's Bachelor of Arts (Psychology) teaches you about people's behaviour, their thought processes and what makes them think in their own unique way.",Deakin University,http://www.deakin.edu.au/course/bachelor-arts-psychology
Bachelor of Communication (Digital Media),Undergraduate,,"Explore media, consumerism and censorship in Deakin's Bachelor of Communication (Digital Media), to launch a career in digital media, film or advertising.",Deakin University,http://www.deakin.edu.au/course/bachelor-communication-digital-media
Bachelor of Design (Visual Communication),Undergraduate,,"Learn the tools, strategies and design thinking methodologies required to be an adaptable, multidisciplinary communication designer. All applicants for the Bachelor of Design (Visual Communication) need to submit a portfolio to Deakin. See details in the Entry Requirements.",Deakin University,http://www.deakin.edu.au/course/bachelor-design-visual-communication
Bachelor of Biomedical Science,Undergraduate,,"From basic biology to disease processes, get an understanding of the causes, diagnosis and treatment of disease at a molecular, cellular and systems level.",Deakin University,http://www.deakin.edu.au/course/bachelor-biomedical-science
Bachelor of Business Analytics,Undergraduate,,"With a Bachelor of Business Analytics (previously Bachelor of Information Systems) from Deakin, you can set yourself up for a satisfying and rewarding career from project manager to business analyst.",Deakin University,http://www.deakin.edu.au/course/bachelor-business-analytics
Bachelor of Construction Management (Honours),Undergraduate,,"Build a career spanning domestic or commercial projects, from construction management to surveying, with this professionally accredited course.",Deakin University,http://www.deakin.edu.au/course/bachelor-construction-management-honours
Bachelor of Electrical and Electronics Engineering (Honours),Undergraduate,,"Acquire sought-after skills in power generation, distribution and control to prepare yourself for the renewable energy careers of the future.",Deakin University,http://www.deakin.edu.au/course/bachelor-electrical-and-electronics-engineering-honours
Bachelor of Exercise and Sport Science,Undergraduate,,"The leading undergraduate course of its sector in Victoria, the Bachelor of Exercise and Sport Science offers specialisations from coaching to health.",Deakin University,http://www.deakin.edu.au/course/bachelor-exercise-and-sport-science
Bachelor of Forensic Science/Bachelor of Criminology,Undergraduate,,Gain a valuable insight into criminal behaviour whilst developing a full range of practical skills that will take you from crime scene to courtroom.,Deakin University,http://www.deakin.edu.au/course/bachelor-forensic-science-bachelor-criminology
Bachelor of Laws/Bachelor of International Studies,Undergraduate,,"Deakin's Bachelor of Laws/Bachelor of International Studies offers a broad, internationally-focused education including studying or interning overseas.",Deakin University,http://www.deakin.edu.au/course/bachelor-laws-bachelor-international-studies
Bachelor of Nursing (Honours),Undergraduate,,Learn new research skills and enhance your career with a Bachelor of Nursing (Honours). Enrol in an Honours at Deakin University for that competitive edge.,Deakin University,http://www.deakin.edu.au/course/bachelor-nursing-honours
Bachelor of Nutrition Science,Undergraduate,,"The Bachelor of Nutrition Science will ensure you are job ready by offering industry placements in health, diet and wellbeing.",Deakin University,http://www.deakin.edu.au/course/bachelor-nutrition-science
Bachelor of Public Health and Health Promotion,Undergraduate,,Help to develop the health and wellbeing of individuals and the communities we live in with Deakin's Bachelor of Public Health and Health Promotion.,Deakin University,http://www.deakin.edu.au/course/bachelor-public-health-and-health-promotion
Bachelor of Public Health and Health Promotion/Bachelor of Commerce,Undergraduate,,"This undergraduate course prepares you for a whole range of different careers including business, marketing, health care management or health promotion.",Deakin University,http://www.deakin.edu.au/course/bachelor-public-health-and-health-promotion-bachelor-commerce
Bachelor of Science,Undergraduate,,"Choose from our range of specialisations to align your degree to your career aspirations  be it biology, chemistry, geography, genomics or more.",Deakin University,http://www.deakin.edu.au/course/bachelor-science
Bachelor of Science/Bachelor of Laws,Undergraduate,,Study Deakin's combined Bachelor of Science/Bachelor of Laws and you'll be sought-after for specialist roles in areas where law and science meet.,Deakin University,http://www.deakin.edu.au/course/bachelor-science-bachelor-laws
Bachelor of Software Engineering (Honours),Undergraduate,,Gain skills in robotics and cyber-physical systems to prepare yourself for a career creating and developing the smart software and systems of the future.,Deakin University,http://www.deakin.edu.au/course/bachelor-software-engineering-honours
Bachelor of Communication (Advertising),Undergraduate,,Deakin's Bachelor of Communication (Advertising) will prepare you for the challenges and excitement of developing incisive brand communication for the digital era.,Deakin University,http://www.deakin.edu.au/course/bachelor-communication-advertising
Bachelor of Food and Nutrition Sciences (Honours),Undergraduate,,Develop your research and investigative skills with a Bachelor of Food and Nutrition Sciences (Honours) at Deakin. Find out how you can apply today.,Deakin University,http://www.deakin.edu.au/course/bachelor-food-and-nutrition-sciences-honours
Bachelor of Health and Medical Science (Honours),Undergraduate,,Develop your research and investigative skills with a Bachelor of Health and Medical Science (Honours) at Deakin. Apply for this course today.,Deakin University,http://www.deakin.edu.au/course/bachelor-health-and-medical-science-honours
Bachelor of Nursing/Bachelor of Public Health and Health Promotion,Undergraduate,,"This combined undergraduate degree provides insights into promoting health and preventing disability, and allows you to graduate as a Registered Nurse.",Deakin University,http://www.deakin.edu.au/course/bachelor-nursing-bachelor-public-health-and-health-promotion
Bachelor of Occupational Therapy,Undergraduate,,"Study a Bachelor of Occupational Therapy course at Deakin to work in Australia or overseas, improving people's lives and promoting workplace wellbeing.",Deakin University,http://www.deakin.edu.au/course/bachelor-occupational-therapy
Bachelor of Nursing/Bachelor of Midwifery,Undergraduate,,This unique undergraduate degree increases your skillset and career options by providing both Registered Nurse and Registered Midwife qualifications.,Deakin University,http://www.deakin.edu.au/course/bachelor-nursing-bachelor-midwifery
Bachelor of Computer Science,Undergraduate,,Learn to design and develop innovative software solutions to complex industry problems and influence the future of technological development.,Deakin University,http://www.deakin.edu.au/course/bachelor-computer-science
Bachelor of Design (Digital Technologies),Undergraduate,,"Develop the technical skills required to delve into software design, user interface design and design for augmented and virtual realities. All applicants for the Bachelor of Design (Digital Technologies) need to submit a portfolio to Deakin. See details in the Entry Requirements.",Deakin University,http://www.deakin.edu.au/course/bachelor-design-digital-technologies
Bachelor of Environmental Engineering (Honours),Undergraduate,,Focus on the practical application of engineering and scientific principles to become an immediately employable environmental engineer.,Deakin University,http://www.deakin.edu.au/course/bachelor-environmental-engineering-honours
Bachelor of Environmental Science (Environmental Management and Sustainability),Undergraduate,,Study environmental management and sustainability and develop solutions to the environmental issues we face on a national and international scale.,Deakin University,http://www.deakin.edu.au/course/bachelor-environmental-science-environmental-management-and-sustainability
Bachelor of Exercise and Sport Science/Bachelor of Business (Sport Management),Undergraduate,,"Our undergraduate Sport Science/Business course will provide a great range of insight into the skills related to sport, health and business management.",Deakin University,http://www.deakin.edu.au/course/bachelor-exercise-and-sport-science-bachelor-business-sport-management
Bachelor of Property and Real Estate/Bachelor of Laws,Undergraduate,,This unique undergraduate course allows you to gain professionally recognised qualifications by developing in depth knowledge of both real estate and law.,Deakin University,http://www.deakin.edu.au/course/bachelor-property-and-real-estate-bachelor-laws
