Course_Name,Course_Level,Course_Type,Cource_Description,University_Name,Link
Graduate Diploma of Commerce,Postgraduate,,Deakin's Graduate Diploma of Commerce will help you gain an understanding of key business disciplines that can be applied in any industry.,Deakin University,http://www.deakin.edu.au/course/graduate-diploma-commerce
Graduate Diploma of Communication,Postgraduate,,"Undertake postgraduate study in communications and delve into the technological, political, economical and social changes disrupting the industry. Apply for a Graduate Diploma of Communication at Deakin today.",Deakin University,http://www.deakin.edu.au/course/graduate-diploma-communication
Graduate Diploma of Creative Arts,Postgraduate,,Move your career in a new direction with a Graduate Diploma of Creative Arts and explore topics related to sustainable creative practices and research.,Deakin University,http://www.deakin.edu.au/course/graduate-diploma-creative-arts
Graduate Diploma of Creative Writing,Postgraduate,,Take your career to the next level and craft your ideas into a story-telling context by studying a Graduate Diploma of Creative Writing at Deakin.,Deakin University,http://www.deakin.edu.au/course/graduate-diploma-creative-writing
Graduate Diploma of Financial Planning,Postgraduate,,Deakin's Graduate Diploma of Financial Planning will enable you to examine the theoretical frameworks of finance and delve into practical application.,Deakin University,http://www.deakin.edu.au/course/graduate-diploma-financial-planning
Graduate Diploma of Health Promotion,Postgraduate,,Undertake postgraduate study at Deakin with a Graduate Diploma of Health Promotion and extend your professional knowledge of health principles and values.,Deakin University,http://www.deakin.edu.au/course/graduate-diploma-health-promotion
Graduate Diploma of Information Systems,Postgraduate,,"Gain skills in eBusiness, supply chain management and project management through postgrad study and Deakin's Graduate Diploma of Information Systems.",Deakin University,http://www.deakin.edu.au/course/graduate-diploma-information-systems
Graduate Diploma of Information Technology,Postgraduate,,"Expand your current understanding of IT and gain advanced skills through specialised study, technical learning and practical experience.",Deakin University,http://www.deakin.edu.au/course/graduate-diploma-information-technology
Graduate Diploma of International Finance,Postgraduate,,A Graduate Diploma in International Finance can lead you to new opportunities in finance and allow you to pursue postgraduate study. Find out more.,Deakin University,http://www.deakin.edu.au/course/graduate-diploma-international-finance
Graduate Diploma of International and Community Development,Postgraduate,,"Study Deakin's postgraduate course, the Graduate Diploma of International and Community Development, to examine the history of development and conflicts.",Deakin University,http://www.deakin.edu.au/course/graduate-diploma-international-and-community-development
Graduate Diploma of Journalism,Postgraduate,,"Enrol for Deakin's postgraduate course, the Graduate Diploma of Journalism, to enhance your creativity, critical thinking and analytical skills.",Deakin University,http://www.deakin.edu.au/course/graduate-diploma-journalism
Graduate Diploma of Midwifery,Postgraduate,,"This postgraduate course, the Graduate Diploma of Midwifery, is specifically designed to enable you to apply for registration as a midwife upon completion.",Deakin University,http://www.deakin.edu.au/course/graduate-diploma-midwifery
Graduate Diploma of Professional Accounting,Postgraduate,,Take your skills and knowledge of the finance and business field to the next level by enrolling in a Graduate Diploma in Professional Accounting.,Deakin University,http://www.deakin.edu.au/course/graduate-diploma-professional-accounting
Graduate Diploma of Professional Writing,Postgraduate,,"Broaden your writing style, context and notions with a Graduate Diploma of Professional Writing. Pursue your career in writing today and apply now.",Deakin University,http://www.deakin.edu.au/course/graduate-diploma-professional-writing
Graduate Diploma of Sustainable Regional Development,Postgraduate,,"Develop the analytical, research planning and management skills needed to help find practical solutions to regional sustainability issues.",Deakin University,http://www.deakin.edu.au/course/graduate-diploma-sustainable-regional-development
Graduate Diploma of Television Production,Postgraduate,,Equip yourself with production and management skills by studying a Graduate Diploma of Television Production. Find out more about the course or apply now.,Deakin University,http://www.deakin.edu.au/course/graduate-diploma-television-production
Graduate Diploma of Writing and Literature,Postgraduate,,Learn theoretical and practical writing skills when you undertake the Graduate Diploma of Writing and English Literature course at Deakin. Apply now.,Deakin University,http://www.deakin.edu.au/course/graduate-diploma-writing-and-literature
Master of Architecture (Design Management),Postgraduate,,"Expand your skills in architectural design, technology and leadership and make significant progress towards becoming a registered architect.",Deakin University,http://www.deakin.edu.au/course/master-architecture-design-management
Master of Arts (Writing and Literature),Postgraduate,,"Craft your literary and creative writing skills into a unique talent and study Deakin's postgraduate course, the Master of Arts (Writing and Literature).",Deakin University,http://www.deakin.edu.au/course/master-arts-writing-and-literature
Master of Business (Sport Management),Postgraduate,,"Study Deakin's postgraduate course, the Master of Business (Sport Management) and prepare to enter a leadership or managerial role in the field of sport.",Deakin University,http://www.deakin.edu.au/course/master-business-sport-management
Master of Construction Management (Professional),Postgraduate,,"Extend your knowledge of construction management with specialised skills in leadership for a career in residential, commercial or industrial projects.",Deakin University,http://www.deakin.edu.au/course/master-construction-management-professional
Master of Creative Arts,Postgraduate,,"Study Deakin's postgraduate course, the Master of Creative Arts, to explore historical and contemporary ideologies that shape the field of creative arts.",Deakin University,http://www.deakin.edu.au/course/master-creative-arts
Master of Engineering (Professional),Postgraduate,,"Expand your knowledge and build the analytical, technical and leadership skills needed to advance your career as a professional engineer.",Deakin University,http://www.deakin.edu.au/course/master-engineering-professional
Master of Financial Planning,Postgraduate,,Learn how to translate theory into practice by developing feasible financial planning solutions for clients. Apply to study a Master of Financial Planning.,Deakin University,http://www.deakin.edu.au/course/master-financial-planning
Master of Health Economics,Postgraduate,,"Apply to study a Master of Health Economics at Deakin and gain a theoretical understanding of topics such as health care finance, policies and development.",Deakin University,http://www.deakin.edu.au/course/master-health-economics
Master of Health Promotion,Postgraduate,,Educate clients and the wider community on how to implement healthy living with a postgraduate qualification in health promotion from Deakin.,Deakin University,http://www.deakin.edu.au/course/master-health-promotion
Master of Human Resource Management,Postgraduate,,Expand your career opportunities and refine your skills in hiring practices and leadership by studying a Master of Human Resource Management course.,Deakin University,http://www.deakin.edu.au/course/master-human-resource-management
Master of Information Technology,Postgraduate,,Prepare yourself for a successful career as an IT professional through our industry informed curriculum and emphasis on practical experience opportunities.,Deakin University,http://www.deakin.edu.au/course/master-information-technology
Master of International and Community Development,Postgraduate,,The postgrad Master of International and Community Development course at Deakin is designed to provide analytical and practical skills.,Deakin University,http://www.deakin.edu.au/course/master-international-and-community-development
Master of Landscape Architecture,Postgraduate,,"Learn to influence the creation of environments that improve the quality of towns, cities and regional landscapes with a sustainable and creative flair.",Deakin University,http://www.deakin.edu.au/course/master-landscape-architecture
Master of Optometry,Postgraduate,,Develop the knowledge and attributes required to practise as an optometrist within Australia and New Zealand.,Deakin University,http://www.deakin.edu.au/course/master-optometry
Master of Psychology (Organisational),Postgraduate,,"Acquire the academic, practical and research skills needed for a career in psychology by obtaining a Master of Organisation Psychology at Deakin. See more.",Deakin University,http://www.deakin.edu.au/course/master-psychology-organisational
Master of Teaching (Early Childhood),Postgraduate,,"Accredited by the VIT, Deakin's postgraduate course, the Master of Teaching (Early Childhood) is tailored for students who seek professional qualification.",Deakin University,http://www.deakin.edu.au/course/master-teaching-early-childhood
Master of Teaching (Primary),Postgraduate,,"By studying Deakin's postgrad course, the Master of Teaching (Primary), you'll learn core teaching subjects and will be eligible to register with the VIT.",Deakin University,http://www.deakin.edu.au/course/master-teaching-primary
Master of Languages Teaching,Postgraduate,,"Deakin's postgrad course, the Master of Languages Teaching offers qualified teachers a thorough grounding in the theory and practice of languages teaching.",Deakin University,http://www.deakin.edu.au/course/master-languages-teaching
Doctor of Philosophy (Arts),Postgraduate,,"Apply to study Philosophy on a doctorate level in Arts at Deakin and research various theories surrounding political, social and contemporary issues.",Deakin University,http://www.deakin.edu.au/course/doctor-philosophy-arts
Master of Applied Science (Health and Disease),Postgraduate,,Undertake research into the molecular basis of health and disease.,Deakin University,http://www.deakin.edu.au/course/master-applied-science-health-disease
Master of Architecture (Research),Postgraduate,,"Deepen your knowledge on a chosen topic within the field of architecture through independent, sustained and academically-supervised research.",Deakin University,http://www.deakin.edu.au/course/master-architecture-research
Master of Education (Research),Postgraduate,,Pursue a combined interest in research and education by studying a postgraduate Master of Education (Research) at Deakin. Apply today.,Deakin University,http://www.deakin.edu.au/course/master-education-research
Master of Science (Biology and Chemical Sciences),Postgraduate,,"Deepen your knowledge within the field of biological and chemical sciences through independent, sustained and academically-supervised research.",Deakin University,http://www.deakin.edu.au/course/master-science-biology-chemical-sciences
Master of Science (Environmental Science),Postgraduate,,"Deepen your knowledge on a chosen topic within the environmental science field through independent, sustained and academically-supervised research.",Deakin University,http://www.deakin.edu.au/course/master-science-environmental-science
Master of Science (Information Technology),Postgraduate,,"Deepen your knowledge on a chosen topic within the information technology field through independent, sustained and academically-supervised research.",Deakin University,http://www.deakin.edu.au/course/master-science-information-technology
Doctor of Philosophy (Environmental Science),Postgraduate,,"Explore various theories surrounding political, social and contemporary issues in environmental science through academically-supervised research.",Deakin University,http://www.deakin.edu.au/course/doctor-philosophy-environmental-science
Doctor of Philosophy (Nursing),Postgraduate,,Make a significant contribution to your chosen field by undertaking PhD research that is grounded in clinical practice.,Deakin University,http://www.deakin.edu.au/course/doctor-philosophy-nursing
Doctor of Philosophy (Health),Postgraduate,,Undertake research in a health and health services related topic under the supervision of an academic staff member in the School of Medicine.,Deakin University,http://www.deakin.edu.au/course/doctor-philosophy-health
Doctor of Philosophy (Psychology),Postgraduate,,"Delve into health and psychology research via Deakin's Doctor of Philosophy. Our research topics are varied, from childhood development to addressing mental health issues and neurological disorders.",Deakin University,http://www.deakin.edu.au/course/doctor-philosophy-psychology
Doctor of Philosophy (Health and Disease),Postgraduate,,Undertake research into the molecular basis of health and disease under the supervision of an academic staff member in the School of Medicine.,Deakin University,http://www.deakin.edu.au/course/doctor-philosophy-health-disease
Doctor of Philosophy (Exercise Science and Sport),Postgraduate,,"Gain expertise in exercise science via Deakin's Doctor of Philosophy. You can also focus your PhD research in areas like sports, fitness or nutrition.",Deakin University,http://www.deakin.edu.au/course/doctor-philosophy-exercise-science-sport
Graduate Certificate of Business (Sport Management),Postgraduate,,Study the Graduate Certificate of Business (Sport Management) to gain theoretical knowledge of sport focused business disciplines.,Deakin University,http://www.deakin.edu.au/course/graduate-certificate-business-sport-management-international
Graduate Certificate of Commerce,Postgraduate,,"The Graduate Certificate of Commerce, a postgrad course from Deakin, gives applicants without an undergraduate degree access to the Master of Commerce.",Deakin University,http://www.deakin.edu.au/course/graduate-certificate-commerce-international
Graduate Certificate of Creative Arts,Postgraduate,,"Understand the social, political and cultural contexts that ground creative art. Study Deakin's postgrad course, the Graduate Certificate of Creative Arts.",Deakin University,http://www.deakin.edu.au/course/graduate-certificate-creative-arts-international
Graduate Certificate of Diabetes Education,Postgraduate,,"Accredited by the Australia Diabetes Educators Association, this course prepares health care professionals for specialty practice in diabetes education.",Deakin University,http://www.deakin.edu.au/course/graduate-certificate-diabetes-education-international
Graduate Certificate of Human Nutrition,Postgraduate,,"Learn about nutrition in a broad context with Deakin's postgraduate course, the Graduate Certificate of Human Nutrition.",Deakin University,http://www.deakin.edu.au/course/graduate-certificate-human-nutrition-international
Graduate Certificate of Human Resource Management,Postgraduate,,"Study Deakin's postgrad course, the Graduate Certificate in Human Resource Management, and extend your knowledge about the principles of the profession.",Deakin University,http://www.deakin.edu.au/course/graduate-certificate-human-resource-management-international
Graduate Certificate of Information Systems,Postgraduate,,"Take your knowledge of information systems and commerce to the next level via Deakin's postgrad course, the Graduate Certificate of Information Systems.",Deakin University,http://www.deakin.edu.au/course/graduate-certificate-information-systems-international
Graduate Certificate of Information Technology,Postgraduate,,This course provides a postgraduate introduction to IT and is ideally suited to those without a computing background.,Deakin University,http://www.deakin.edu.au/course/graduate-certificate-information-technology-international
Graduate Certificate of International Finance,Postgraduate,,Analyse the structure and operations of financial aspects in global markets by enrolling in Deakin's Graduate Certificate of International Finance.,Deakin University,http://www.deakin.edu.au/course/graduate-certificate-international-finance-international
Graduate Certificate of International and Community Development,Postgraduate,,"Deakin's Graduate Certificate of International and Community Development, will introduce you to international and community development issues. Apply now.",Deakin University,http://www.deakin.edu.au/course/graduate-certificate-international-and-community-development-international
Graduate Certificate of Professional Accounting,Postgraduate,,"Graduate with an understanding of accounting, finance and business principles when you apply to study a postgraduate Professional Accounting course.",Deakin University,http://www.deakin.edu.au/course/graduate-certificate-professional-accounting-international
Graduate Certificate of Sustainable Regional Development,Postgraduate,,"Gain an introduction to sustainable regional and rural development, natural resource management and climate change adaptation planning.",Deakin University,http://www.deakin.edu.au/course/graduate-certificate-sustainable-regional-development-international
Graduate Certificate of Teaching English to Speakers of Other Languages,Postgraduate,,"Gain specialist teaching skills via Deakin's postgraduate course, the Graduate Certificate of Teaching English to Speakers of other Languages.",Deakin University,http://www.deakin.edu.au/course/graduate-certificate-teaching-english-to-speakers-other-languages-international
Graduate Diploma of Children's Literature,Postgraduate,,"By undertaking Deakin's postgraduate course, the Graduate Diploma of Children's Literature, you'll explore iconic novels and films to interpret.",Deakin University,http://www.deakin.edu.au/course/graduate-diploma-childrens-literature-international
Graduate Diploma of Commerce,Postgraduate,,"Build on your undergraduate qualification in any field, with Deakin's postgraduate course, the Graduate Diploma of Commerce.",Deakin University,http://www.deakin.edu.au/course/graduate-diploma-commerce-international
Graduate Diploma of Creative Arts,Postgraduate,,"Study Deakin's postgraduate course, the Graduate Diploma of Creative Arts and explore topics related to sustainable creative practices and research.",Deakin University,http://www.deakin.edu.au/course/graduate-diploma-creative-arts-international
Graduate Diploma of Creative Writing,Postgraduate,,Learn how to craft your ideas into a story-telling context by studying a postgraduate Graduate of Diploma of Literary Studies course.,Deakin University,http://www.deakin.edu.au/course/graduate-diploma-creative-writing-international
Graduate Diploma of Health Promotion,Postgraduate,,Learn the foundation of health principles and values by applying to study a postgraduate Graduate Diploma of Health Promotion course.,Deakin University,http://www.deakin.edu.au/course/graduate-diploma-health-promotion-international
Graduate Diploma of International Finance,Postgraduate,,A postgrad Graduate Diploma in International Trade and Finance course can lead you to new opportunities in finance and allow you to pursue further study.,Deakin University,http://www.deakin.edu.au/course/graduate-diploma-international-finance-international
Graduate Diploma of International and Community Development,Postgraduate,,The postgraduate Graduate Diploma of International and Community Development course examines historical records of development and conflicts.,Deakin University,http://www.deakin.edu.au/course/graduate-diploma-international-and-community-development-international
Graduate Diploma of Journalism,Postgraduate,,"Enhance your creativity, critical thinking and analytical skills and learn advanced communication frameworks with a Graduate Diploma of Journalism.",Deakin University,http://www.deakin.edu.au/course/graduate-diploma-journalism-international
Graduate Diploma of Literary Studies,Postgraduate,,Take your creativity a step further and learn about traditional and new forms of literature with a postgrad Graduate Diploma of English Literary Studies.,Deakin University,http://www.deakin.edu.au/course/graduate-diploma-literary-studies-international
Graduate Diploma of Professional Accounting,Postgraduate,,Expand your skills and knowledge of the finance and business field by enrolling in a postgrad Graduate Diploma in Professional Accounting course.,Deakin University,http://www.deakin.edu.au/course/graduate-diploma-professional-accounting-international
Graduate Diploma of Professional Writing,Postgraduate,,"Broaden your writing style, context and notions with a postgraduate Graduate Diploma of Professional Writing course.",Deakin University,http://www.deakin.edu.au/course/graduate-diploma-professional-writing-international
Graduate Diploma of Property,Postgraduate,,"With a Graduate Diploma of Property, you'll gain relevant industry knowledge and be exposed to a practical approach in learning. Get started by applying.",Deakin University,http://www.deakin.edu.au/course/graduate-diploma-property-international
Graduate Diploma of Psychology,Postgraduate,,"If you are a psychology graduate, undertake an additional year of study to get registered as a provisional psychologist.",Deakin University,http://www.deakin.edu.au/course/graduate-diploma-psychology-international
Graduate Diploma of Sustainable Regional Development,Postgraduate,,"Develop the analytical, research planning and management skills needed to help find practical solutions to regional sustainability issues.",Deakin University,http://www.deakin.edu.au/course/graduate-diploma-sustainable-regional-development-international
Graduate Diploma of Writing and Literature,Postgraduate,,Learn theoretical and practical writing skills when you undertake the Graduate Diploma of Writing and English Literature course at Deakin. Apply now.,Deakin University,http://www.deakin.edu.au/course/graduate-diploma-writing-and-literature-international
Master of Arts (Writing and Literature),Postgraduate,,"Craft your literary and creative writing skills into a masterful talent through a postgrad course, the Master of Arts (Writing and Literature), at Deakin.",Deakin University,http://www.deakin.edu.au/course/master-arts-writing-and-literature-international
Master of Clinical Exercise Physiology,Postgraduate,,"Study Deakin's postgrad course, the Master of Clinical Exercise Physiology, and benefit from exceptional teaching and employment outcomes in the sector.",Deakin University,http://www.deakin.edu.au/course/master-clinical-exercise-physiology-international
Master of Construction Management,Postgraduate,,"Expand your understanding of construction management through innovative practice, cutting-edge research and leadership training.",Deakin University,http://www.deakin.edu.au/course/master-construction-management-international
Master of Construction Management (Professional),Postgraduate,,"Extend your knowledge of construction management with specialised skills in leadership for a career in residential, commercial or industrial projects.",Deakin University,http://www.deakin.edu.au/course/master-construction-management-professional-international
Master of Creative Arts,Postgraduate,,Expand your understanding of historical and contemporary ideologies that shape the creative arts through a Master of Creative Arts at Deakin.,Deakin University,http://www.deakin.edu.au/course/master-creative-arts-international
Master of Human Resource Management,Postgraduate,,Refine your skills in hiring practices and leadership when studying a Master of Human Resource Management at Deakin.,Deakin University,http://www.deakin.edu.au/course/master-human-resource-management-international
Master of Information Systems,Postgraduate,,Deakin's Master of Information Systems will teach you how to be more reactive to our emerging information-focused economy. Apply now.,Deakin University,http://www.deakin.edu.au/course/master-information-systems-international
Master of Information Technology (Professional),Postgraduate,,"Extend your knowledge of information technology, application and leadership with specialised skills that are highly sought-after across industry sectors.",Deakin University,http://www.deakin.edu.au/course/master-information-technology-professional-international
Master of Professional Accounting,Postgraduate,,Work towards opening new doors in your career by expanding your skills and knowledge in business and finance with a Master of Professional Accounting.,Deakin University,http://www.deakin.edu.au/course/master-professional-accounting-international
Doctor of Philosophy (Information Technology),Postgraduate,,"Explore various theories surrounding political, social and contemporary issues in information technology through academically-supervised research.",Deakin University,http://www.deakin.edu.au/course/doctor-philosophy-information-technology
Doctor of Philosophy (Biology and Chemistry),Postgraduate,,"Explore various theories surrounding political, social and contemporary issues in biological and chemical science through academically-supervised research.",Deakin University,http://www.deakin.edu.au/course/doctor-philosophy-biology-chemistry
Master of Philosophy (Electromaterials),Postgraduate,,The Master of Philosophy (Electromaterials) aims to meet the growing need for well trained scientists to work in the Electromaterials environment.,Deakin University,http://www.deakin.edu.au/course/master-philosophy-electromaterials
